{"cases":[{"assertions":[{"check":{"id":"duration","type":"contains","value":"8 hours"},"step":"draft"},{"check":{"id":"verdict","type":"contains","value":"Verdict: PASS"},"step":"review"}],"id":"release-facts","input":"Write release notes using the supplied sources, then review the actual draft.","minPasses":2,"runs":3}],"edgeRequirements":[],"entry":"writer","id":"release","mode":"pipeline","schemaVersion":"kmx.flow/v1alpha1","steps":[{"id":"draft","input":{"source":"run.input"},"member":"writer"},{"approval":"policy-controlled","id":"review","input":{"context":"run.input","source":"draft.output"},"member":"reviewer"}]}